africa,NCT01594931,Phase II Dose-ranging Study of Pyronaridine/Artesunate in Adults Patients With Plasmodium Falciparum Malaria,OTHER,TREATMENT,DRUG,477,3,6,6,Cambodia | Indonesia | Senegal | Thailand | The Gambia | Uganda,Senegal | Uganda,True,2005-07-01,2006-03-01,2021-09-17,243,5679,-2502,False,True,True,False,23433102,,,38.89,21.95,19.45,29.07,1,0,0,0,0,0,,,,,,,,,no_primary_analysis_structured,True,Medicines for Malaria Venture,likely_externally_run,low,"named sponsor or investigator affiliation is present, but it does not match African site institutions",,"Hospital of Tropical Diseases, Mahidol University, Bangkok, Thailand | Nat. Centre for Parasitol., Entomol. and Malaria Control, Phnom Penh, Cambodia | Bethesda Hospital, Tomohon, North Sulawasi, Indonesia | MRC Laboratories, Faraffeni, The Gambia | Epicentre, Mbarara, Uganda | Centre de santé Roi Baudouin, Guediawaye, Senegal",False,29.07
africa,NCT00403260,Pyronaridine - Artesunate (3:1) Versus Mefloquine Plus Artesunate in Plasmodium Falciparum Malaria Patients,OTHER,TREATMENT,DRUG,1271,2,9,7,Burkina Faso | Cambodia | Côte d’Ivoire | India | Tanzania | Thailand | Vietnam,Burkina Faso | Tanzania,True,2007-01-01,2008-10-01,2021-09-17,639,4734,40,True,True,True,True,22475593|23433102|26666916,22475593,1282,18.17,20.55,23.09,19.99,1,1,1,0,1,1,0.106,Percentage of Subjects With PCR-corrected Adequate Clinical and Parasitological Response (ACPR) on Day 28,Chi-squared,ACPR percent difference,1.1,-0.2,3.1,0.106,effect_estimate_no_significance,True,Medicines for Malaria Venture,likely_externally_run,low,"named sponsor or investigator affiliation is present, but it does not match African site institutions",,Medicines for Malaria Venture,False,28.99
africa,NCT00197028,Examine Safety and Immune Responses of GSK 257049 Vaccine When Administered to Infants Living in a Malaria-endemic Region,INDUSTRY,PREVENTION,BIOLOGICAL,214,2,1,1,Mozambique,Mozambique,True,2005-08-23,2007-12-27,2013-01-18,856,1849,-21,False,True,True,False,17949807|21079803,,,22.22,43.33,11.11,27.39,1,0,0,0,0,0,,,,,,,,,no_primary_analysis_structured,True,GlaxoSmithKline,likely_externally_run,medium,lead sponsor class is `INDUSTRY` and no local-affiliation match was found,,GlaxoSmithKline,False,27.39
africa,NCT03178643,Enhancing Preventive Therapy of Malaria In Children With Sickle Cell Anemia in East Africa (EPiTOMISE),OTHER,PREVENTION,DRUG,246,3,1,1,Kenya,Kenya,True,2018-01-23,2020-12-16,2024-03-27,1058,1197,236,True,True,True,False,36215323,,,23.61,37.08,17.8,27.16,1,0,0,0,0,0,,,,,,,,,no_primary_analysis_structured,True,Duke University,likely_externally_run,low,"named sponsor or investigator affiliation is present, but it does not match African site institutions",,,True,27.16
africa,NCT03276962,"Efficacy, Safety and Immunogenicity Study of GSK Biologicals' Candidate Malaria Vaccine (SB257049) Evaluating Schedules With or Without Fractional Doses, Early Dose 4 and Yearly Doses, in Children 5-17 Months of Age",INDUSTRY,PREVENTION,BIOLOGICAL,1500,5,2,2,Ghana | Kenya,Ghana | Kenya,True,2017-09-28,2019-11-04,2024-05-21,767,1660,21,True,True,True,False,35753316|38045387|38438123|38723650|40975080,,,26.39,15.56,19.2,21.16,1,1,1,0,1,1,0.154,Incidence of Clinical Malaria Meeting the Primary Case Definition,"Regression, Cox",Incremental vaccine efficacy,-21,-57,7,0.154,effect_estimate_no_significance,True,GlaxoSmithKline,likely_externally_run,medium,lead sponsor class is `INDUSTRY` and no local-affiliation match was found,,GlaxoSmithKline,False,26.16
africa,NCT01148459,Safety and Immunogenicity of GSK Biologicals' Investigational Malaria Vaccine in HIV Infected Infants and Children,INDUSTRY,PREVENTION,BIOLOGICAL,200,2,2,1,Kenya,Kenya,True,2010-07-30,2013-05-24,2019-01-16,1029,2063,43,True,True,True,False,27394191,,,17.22,40.41,14.61,24.81,1,0,0,0,0,0,,,,,,,,,no_primary_analysis_structured,True,GlaxoSmithKline,likely_externally_run,medium,lead sponsor class is `INDUSTRY` and no local-affiliation match was found,,GlaxoSmithKline,True,24.81
